[
    {
        "name": "test0",
        "phone": "4655977201",
        "business": "salon",
        "service_type": "manicure",
        "location": {
            "latitude": 86.622618,
            "longitude": -19.974958
        }
    },
    {
        "name": "test1",
        "phone": "6183967425",
        "business": "salon",
        "service_type": "massage-therapy",
        "location": {
            "latitude": 28.005366,
            "longitude": 43.999733
        }
    },
    {
        "name": "test2",
        "phone": "8005044499",
        "business": "salon",
        "service_type": "pedicure",
        "location": {
            "latitude": 87.361781,
            "longitude": -162.001432
        }
    },
    {
        "name": "test3",
        "phone": "3010333748",
        "business": "salon",
        "service_type": "hair-cutting",
        "location": {
            "latitude": -72.278288,
            "longitude": -13.935117
        }
    },
    {
        "name": "test4",
        "phone": "6860340743",
        "business": "salon",
        "service_type": "hair-cutting",
        "location": {
            "latitude": -44.009687,
            "longitude": -33.003676
        }
    },
    {
        "name": "test5",
        "phone": "7057224985",
        "business": "salon",
        "service_type": "facial-treatment",
        "location": {
            "latitude": 37.631786,
            "longitude": 5.957273
        }
    },
    {
        "name": "test6",
        "phone": "5390284291",
        "business": "salon",
        "service_type": "hair-cutting",
        "location": {
            "latitude": -78.914097,
            "longitude": -148.979331
        }
    },
    {
        "name": "test7",
        "phone": "6242895323",
        "business": "salon",
        "service_type": "hair-cutting",
        "location": {
            "latitude": 27.41058,
            "longitude": -142.311138
        }
    },
    {
        "name": "test8",
        "phone": "3794129684",
        "business": "salon",
        "service_type": "hair-cutting",
        "location": {
            "latitude": 53.255662,
            "longitude": 14.721907
        }
    },
    {
        "name": "test9",
        "phone": "5987340583",
        "business": "salon",
        "service_type": "facial-treatment",
        "location": {
            "latitude": -12.874526,
            "longitude": -31.013079
        }
    },
    {
        "name": "test10",
        "phone": "1434794698",
        "business": "salon",
        "service_type": "manicure",
        "location": {
            "latitude": -54.622274,
            "longitude": -160.363394
        }
    },
    {
        "name": "test11",
        "phone": "3260993724",
        "business": "salon",
        "service_type": "hair-coloring",
        "location": {
            "latitude": 77.858977,
            "longitude": -167.408977
        }
    },
    {
        "name": "test12",
        "phone": "9536730199",
        "business": "salon",
        "service_type": "hair-styling",
        "location": {
            "latitude": 2.127847,
            "longitude": -24.175318
        }
    },
    {
        "name": "test13",
        "phone": "5975142827",
        "business": "salon",
        "service_type": "hair-styling",
        "location": {
            "latitude": 83.778885,
            "longitude": 178.874128
        }
    },
    {
        "name": "test14",
        "phone": "8662483742",
        "business": "salon",
        "service_type": "manicure",
        "location": {
            "latitude": -7.402681,
            "longitude": 39.557606
        }
    },
    {
        "name": "test15",
        "phone": "2842980311",
        "business": "salon",
        "service_type": "massage-therapy",
        "location": {
            "latitude": 5.230436,
            "longitude": -102.41785
        }
    },
    {
        "name": "test16",
        "phone": "1246905565",
        "business": "salon",
        "service_type": "hair-styling",
        "location": {
            "latitude": -36.199563,
            "longitude": 22.326336
        }
    },
    {
        "name": "test17",
        "phone": "6989951909",
        "business": "salon",
        "service_type": "hair-cutting",
        "location": {
            "latitude": 82.341518,
            "longitude": -138.769605
        }
    },
    {
        "name": "test18",
        "phone": "4307705903",
        "business": "salon",
        "service_type": "pedicure",
        "location": {
            "latitude": -24.792926,
            "longitude": 89.813785
        }
    },
    {
        "name": "test19",
        "phone": "3854220259",
        "business": "salon",
        "service_type": "pedicure",
        "location": {
            "latitude": 46.703285,
            "longitude": -84.930113
        }
    },
    {
        "name": "test20",
        "phone": "5368838473",
        "business": "salon",
        "service_type": "massage-therapy",
        "location": {
            "latitude": -20.870522,
            "longitude": 27.284381
        }
    },
    {
        "name": "test21",
        "phone": "5975244906",
        "business": "salon",
        "service_type": "hair-cutting",
        "location": {
            "latitude": -46.944192,
            "longitude": 157.316259
        }
    },
    {
        "name": "test22",
        "phone": "7749357321",
        "business": "salon",
        "service_type": "pedicure",
        "location": {
            "latitude": 78.304157,
            "longitude": 10.651509
        }
    },
    {
        "name": "test23",
        "phone": "8557306376",
        "business": "salon",
        "service_type": "hair-coloring",
        "location": {
            "latitude": -83.023115,
            "longitude": 122.574859
        }
    },
    {
        "name": "test24",
        "phone": "2679987296",
        "business": "salon",
        "service_type": "hair-cutting",
        "location": {
            "latitude": -9.414615,
            "longitude": -174.126536
        }
    },
    {
        "name": "test25",
        "phone": "5366736072",
        "business": "salon",
        "service_type": "pedicure",
        "location": {
            "latitude": 50.520227,
            "longitude": 122.180772
        }
    },
    {
        "name": "test26",
        "phone": "7506682230",
        "business": "salon",
        "service_type": "waxing",
        "location": {
            "latitude": -82.873985,
            "longitude": 166.815174
        }
    },
    {
        "name": "test27",
        "phone": "8868696038",
        "business": "salon",
        "service_type": "hair-cutting",
        "location": {
            "latitude": -34.469208,
            "longitude": 131.945741
        }
    },
    {
        "name": "test28",
        "phone": "6141441347",
        "business": "salon",
        "service_type": "pedicure",
        "location": {
            "latitude": -23.813222,
            "longitude": -50.194357
        }
    },
    {
        "name": "test29",
        "phone": "9109034725",
        "business": "salon",
        "service_type": "facial-treatment",
        "location": {
            "latitude": -14.698237,
            "longitude": 135.727138
        }
    },
    {
        "name": "test30",
        "phone": "3401526308",
        "business": "salon",
        "service_type": "hair-styling",
        "location": {
            "latitude": -57.787736,
            "longitude": 145.723838
        }
    },
    {
        "name": "test31",
        "phone": "3371809237",
        "business": "salon",
        "service_type": "waxing",
        "location": {
            "latitude": 69.947527,
            "longitude": 132.28057
        }
    },
    {
        "name": "test32",
        "phone": "5543526000",
        "business": "salon",
        "service_type": "manicure",
        "location": {
            "latitude": 75.429982,
            "longitude": -57.061876
        }
    },
    {
        "name": "test33",
        "phone": "2292306522",
        "business": "salon",
        "service_type": "pedicure",
        "location": {
            "latitude": -87.434499,
            "longitude": -33.268354
        }
    },
    {
        "name": "test34",
        "phone": "4833930914",
        "business": "salon",
        "service_type": "massage-therapy",
        "location": {
            "latitude": -62.914125,
            "longitude": -137.152472
        }
    },
    {
        "name": "test35",
        "phone": "2650810419",
        "business": "salon",
        "service_type": "waxing",
        "location": {
            "latitude": -72.173545,
            "longitude": 94.273484
        }
    },
    {
        "name": "test36",
        "phone": "3503882680",
        "business": "salon",
        "service_type": "manicure",
        "location": {
            "latitude": 72.047008,
            "longitude": 23.712274
        }
    },
    {
        "name": "test37",
        "phone": "5343661816",
        "business": "salon",
        "service_type": "pedicure",
        "location": {
            "latitude": 71.746955,
            "longitude": -171.477548
        }
    },
    {
        "name": "test38",
        "phone": "4302963733",
        "business": "salon",
        "service_type": "hair-coloring",
        "location": {
            "latitude": 23.800824,
            "longitude": -66.842198
        }
    },
    {
        "name": "test39",
        "phone": "8900141261",
        "business": "salon",
        "service_type": "facial-treatment",
        "location": {
            "latitude": 14.995471,
            "longitude": -119.8504
        }
    },
    {
        "name": "test40",
        "phone": "2262627278",
        "business": "salon",
        "service_type": "hair-cutting",
        "location": {
            "latitude": 23.292685,
            "longitude": -37.505132
        }
    },
    {
        "name": "test41",
        "phone": "1088901860",
        "business": "salon",